photo_id,date_posted,caption,comments,likes,photo_src,is_video
BhFx-ofBKlp,2018-04-02 18:45:21,Looking for more Field Research tasks? Spin your nearby PokéStops to receive Field Research tasks that range from catching certain Pokémon to landing Curveballs. Have fun! #PokemonGOtip,2857,56,https://scontent-sjc3-1.cdninstagram.com/vp/476176d380696edb2f7f941e63bc4b7b/5AC518E2/t51.2885-15/e35/29417939_348024585686561_2600059650653028352_n.jpg,True
BhEoKmQhJHI,2018-04-02 08:00:11,"Trainers, Legendary Pokémon Latias and Latios will fly into regional Raid Battles on April 2. Which one will be near you? #BeLegendary Click the link in our bio to learn more. #Latias #Latios #PokemonGO #Pokemon",23690,568,https://scontent-sjc3-1.cdninstagram.com/vp/5611e0d9af9ec7481a0fcddd76514830/5B523A63/t51.2885-15/e35/29739977_2042097466038157_3134602205047291904_n.jpg,False
Bg_ixkghI7B,2018-03-31 08:36:53,"Experience Pokémon GO like never before with cutting-edge 8-bit graphics! Registering approximately twice the definition of 4K, the chunky squares of each pixel provide realistic detail and unbelievable definition. To learn more, click on our link in the bio! #PokemonGO #Pokemon",30750,2218,https://scontent-sjc3-1.cdninstagram.com/vp/25239fddc0ce92d90dea51d93856730a/5B6B74A6/t51.2885-15/e35/29401124_1598537763592229_1526173593061294080_n.jpg,False
Bg9dybBBm5r,2018-03-30 13:14:49,"Trainers, it’s time to conduct some important Pokémon research and help Professor Willow find Mew! Let’s get moving! #FindMew",15553,291,https://scontent-sjc3-1.cdninstagram.com/vp/0c9b73c37ba664812fc33c233db45b98/5B553CA8/t51.2885-15/e35/29095849_190558251732240_318825296511893504_n.jpg,False
Bg7lPQ4BZLy,2018-03-29 19:41:27,"Know a Raid Battle party team member who didn't catch Lugia when it first came to Pokémon GO? Send a reminder by tagging them in this post. With only a few days left to battle Lugia before it goes back to the ocean, now is your chance! #PokemonGO #Lugia",16732,377,https://scontent-sjc3-1.cdninstagram.com/vp/68b72997bcc212aebe7de884b6afa823/5B52CD0A/t51.2885-15/e35/29714518_160426641442429_2972544056652988416_n.jpg,False
Bg6vlWQB7XU,2018-03-29 11:52:36,"Get ready, Trainers! Field Research and Special Research tasks will be available to you soon. Who among you will be the first to help Professor Willow #FindMew?",22308,426,https://scontent-sjc3-1.cdninstagram.com/vp/2defaf22c5a221f48dc7c3e498486417/5B5E5B54/t51.2885-15/e35/29403048_2116673355233542_4373584713848193024_n.jpg,False
Bg47ZCABYg8,2018-03-28 18:57:34,"As its energy, Togepi uses the positive emotions of compassion and pleasure exuded by people and Pokémon. This Pokémon stores up feelings of happiness inside its shell, then shares them with others. Be like Togepi, and remember to share a smile with another Trainer today! 
#Togepi #PokemonGO",8416,84,https://scontent-sjc3-1.cdninstagram.com/vp/2224bc6e1a3ce39494cca3e93a85c8df/5AC510CE/t51.2885-15/e35/29095847_181316799340179_3920934876412379136_n.jpg,True
Bg3wXckBuFe,2018-03-28 08:01:43,Learn how our developers built the new research feature in Pokémon GO by clicking the link in our bio. #PokemonGO #Pokemon,23068,199,https://scontent-sjc3-1.cdninstagram.com/vp/62400b6504cf80b829ea786bd15417cc/5B540D82/t51.2885-15/e35/29093160_236228356944422_1968291337463660544_n.jpg,False
Bg2Q6aQBJVb,2018-03-27 18:07:38,"Did you know Lugia's wings pack devastating power? A light fluttering of its wings can blow apart regular houses. As a result, this Pokémon chooses to live out of sight deep under the sea. #PokemonGO #Lugia",12276,123,https://scontent-sjc3-1.cdninstagram.com/vp/9b12809a5130bff7329c2e6352786cf2/5B6E3889/t51.2885-15/e35/29403280_1781577708571276_623382595702358016_n.jpg,False
Bg1dcAVBNcI,2018-03-27 10:37:50,"Mark your calendar, Trainers! #PokemonGOCommunityDay returns Sunday, April 15, with Mareep! #PokemonGO",23781,992,https://scontent-sjc3-1.cdninstagram.com/vp/690bd2200912613c61d91118c2daf797/5B520B34/t51.2885-15/e35/29714800_1765119043553926_6435992064806092800_n.jpg,False
BgzpRm_Bbhw,2018-03-26 17:42:48,"Trainers, are you an expert at defending Gyms? Show off your team pride with new Gym Leader avatar items! Depending on your Gym Leader medal rank, pieces of this outfit will be unlocked and available for purchase. #PokemonGO #Pokemon",12790,188,https://scontent-sjc3-1.cdninstagram.com/vp/f38dc921d6f86a21026bd6fe82736eac/5B556BE9/t51.2885-15/e35/29092725_1885981011692681_3198453705720463360_n.jpg,False
BgyZsfwh-Yt,2018-03-26 06:07:25,"Trainers! Professor Willow is seeking Trainers to help him find out if a series of mysterious happenings are connected to the Mythical Pokémon 
Mew. Click the link in our bio to learn more. #PokemonGO #Pokemon",27507,845,https://scontent-sjc3-1.cdninstagram.com/vp/e913684eacadcfb6b52e558d667e5352/5B716A98/t51.2885-15/e35/29400558_179673869343712_6749794324050870272_n.jpg,False
BgxEqTiBhD5,2018-03-25 17:44:22,"Had an amazing time meeting some fellow Trainers on #PokemonGOCommunityDay? Discovered an amazing park or took a great AR photo of Bulbasaur? We'd love to see it! Don't forget to post your #PokemonGOCommunityDay photos, Trainers!",12748,131,https://scontent-sjc3-1.cdninstagram.com/vp/fbb0b52c81836912e0cbb970e5b33f6d/5B50C2A9/t51.2885-15/e35/29402530_619078541767599_3364503356201500672_n.jpg,False
BguLVlBBAYM,2018-03-24 14:44:59,"Make sure to post your best team photos during #PokemonGOCommunityDay, Trainers. We'll be featuring some of our favorite photos on our Community Day website. #PokemonGO",12740,85,https://scontent-sjc3-1.cdninstagram.com/vp/d71b4688708ef52b55be84cfc0481657/5B5E2545/t51.2885-15/e35/29415012_206095709977697_960001447800340480_n.jpg,False
Bgo4hbVBOG3,2018-03-22 13:24:23,Trainers: The Pokémon GO Eggstravaganza is here! Pokémon normally found in 5 km or 10 km Eggs will be in 2 km Eggs until April 2! #PokemonGO #Pokemom #Wynaut,14848,119,https://scontent-sjc3-1.cdninstagram.com/vp/869f4a3e2058d2f2a2301307b34979d2/5B5A99D7/t51.2885-15/e35/29090690_1659351510779764_7886216582941114368_n.jpg,False
Bglvx64B2Mf,2018-03-21 08:10:16,"Trainers, get ready to hatch some egg-citing 2 km Eggs! Eggstravaganza returns on March 22. See the link in our bio to learn more.",17200,206,https://scontent-sjc3-1.cdninstagram.com/vp/7d2dd9dd1cb68009c86359c463747c31/5B5A783E/t51.2885-15/e35/29414732_178672592754831_5745427006544150528_n.jpg,False
BgjyDkqBljr,2018-03-20 13:51:40,"Last month, #TeamMystic dominated Community Day by catching the most Pokémon per player. #TeamInstinct and #TeamValor are you ready to make a comeback? #PokemonGOCommunityDay",12431,567,https://scontent-sjc3-1.cdninstagram.com/vp/048343233cf1564b247b331d94ca837c/5B530E7C/t51.2885-15/e35/28765729_425824074522296_3890100700604006400_n.jpg,False
BghVisKhJyS,2018-03-19 15:04:02,"Looking to defeat Lugia? Being both Rock- and Dark-type, Tyranitar is a supereffective choice against this Legendary Pokémon! #PokemonGOtip #PokemonGO #Pokemon #Lugia #Tyranitar",10942,147,https://scontent-sjc3-1.cdninstagram.com/vp/8edba47171c1199f1b1020078d7350da/5B5946A5/t51.2885-15/e35/28764952_2110055325891033_2531617620214415360_n.jpg,False
BgfVRiuhKeJ,2018-03-18 20:23:13,"Trainers, which of the weather-influenced forms of Castform have you caught so far? #PokemonGO",12502,814,https://scontent-sjc3-1.cdninstagram.com/vp/4f81770242800801dc9048946137a322/5B6EDE7C/t51.2885-15/e35/28763580_422753478173149_3860842996836597760_n.jpg,False
BgehmAwB4Gj,2018-03-18 12:51:37,"Welcome back Lugia by taking an AR photo of it, Trainers! We can't wait to be blown away by your AR photos. #PokemonGO #Lugia #Pokemon",12543,103,https://scontent-sjc3-1.cdninstagram.com/vp/5d7e53694c6105ea10adaaaab69d7e87/5B5BCFAE/t51.2885-15/e35/28754501_401261853677881_5537665617231872000_n.jpg,False
BgZyOKuBXuY,2018-03-16 16:40:43,"Get hyped for #PokemonGOCommunityDay, Trainers! After evolving your Ivysaur into Venusaur during Community Day, your Venusaur will know the exclusive move Frenzy Plant! #PokemonGO #Venusaur",12008,146,https://scontent-sjc3-1.cdninstagram.com/vp/f3b4f8f5804d75a1a7cd23e200ae595d/5B732D3B/t51.2885-15/e35/28436180_159084154791573_2665507165468360704_n.jpg,False
BgXXHrShre2,2018-03-15 18:05:25,"Good news, Trainers! We’re rolling out account linking with Facebook. See the link in our bio to learn more. #PokemonGO",8741,166,https://scontent-sjc3-1.cdninstagram.com/vp/d17f10601b87acb644f8f801cc48e6fe/5B67D78F/t51.2885-15/e35/29087678_1617018901745940_8029688500880146432_n.jpg,False
BgWT7pFBBT7,2018-03-15 08:18:19,"Trainers, get ready! The Legendary Pokémon Lugia will soar back to Raid Battles with an improved move on March 16! See the link in our bio to learn more. #BeLegendary #Lugia #PokemonGO #Pokemon",27422,688,https://scontent-sjc3-1.cdninstagram.com/vp/7547c76bd41f4e0606bd8a44c976b35a/5B537822/t51.2885-15/e35/29090574_2051924575068539_4546617173698674688_n.jpg,False
BgO4ZENhUyE,2018-03-12 11:02:59,"Trainers, which Pokémon that prefer windy weather have you hatched so far? Tell us in the comments! #PokemonGO #Pokemon",11626,543,https://scontent-sjc3-1.cdninstagram.com/vp/d16718171685c4e59bc72a626bc441aa/5B55B86D/t51.2885-15/e35/28752790_575621639458433_8308011860653768704_n.jpg,False
BgK3HFHBSSG,2018-03-10 20:34:50,"Thousands of Trainers from Argentina celebrated last month's #PokemonGOCommunityDay by collecting bags of clothing, hundreds of school supplies, and over a ton of food for their local children's food bank! Awesome job! #PokemonGO #Pokemon",11930,97,https://scontent-sjc3-1.cdninstagram.com/vp/705d6d97bd9fd216847ac55097998009/5B6BDD3F/t51.2885-15/e35/28753467_1698187700220304_3966167109741838336_n.jpg,False
BgIEUMEhdtN,2018-03-09 18:33:19,"Friday's here, Trainers! Celebrate by dancing like Ludicolo. #PokemonGO #Pokemon",10063,132,https://scontent-sjc3-1.cdninstagram.com/vp/4e61e0e007ff143e8b5e6f173618dfac/5AC4F743/t51.2885-15/e35/28752495_579400965748029_2317033598043029504_n.jpg,True
BgAKzolhkZO,2018-03-06 16:55:17,"As a Dragon- and Flying-type Pokémon, Rayquaza is harder to defeat but has boosted CP when caught during windy weather conditions. #PokemonGOtip #PokemonGO #Pokemon #Rayquaza",11296,135,https://scontent-sjc3-1.cdninstagram.com/vp/f18a61f8023addc8b2ee7ea1f7543c76/5B7108C5/t51.2885-15/e35/28434657_1193580057443125_3186357484382060544_n.jpg,False
Bf9Psg0hque,2018-03-05 13:40:17,"The Pokémon GO forecast calls for Pokémon that prefer windy weather to hatch more often from Eggs starting March 5! Plus, enjoy wind-themed Raid Battles and double XP until March 16. See the link in our bio to learn more! 
#TeamRayquaza",13995,152,https://scontent-sjc3-1.cdninstagram.com/vp/af998b24341144c8a3474696346572f4/5B564BDD/t51.2885-15/e35/28428522_416242782136914_5829606866602164224_n.jpg,False
Bf19aSeh6w4,2018-03-02 17:45:50,"Trainers, this legendary week of Raid Battles is heating up! Heading into the weekend, #TeamRayquaza leads by a margin of 52% vs. 48%. Can #TeamKyogre & #TeamGroudon make a comeback?

Remember Trainers, if Rayquaza is defeated more than Kyogre and Groudon combined by 3/5, Pokémon that prefer windy weather will be more likely to hatch from Eggs starting 3/5. If not, Pokémon that prefer sunny or rainy weather will be more likely to hatch.",11143,121,https://scontent-sjc3-1.cdninstagram.com/vp/e287ed3f9ed97f2aef89e89fc0bb7eb7/5B691FA3/t51.2885-15/e35/28158340_549346845446625_7858505539846668288_n.jpg,False
Bfz2EMKBp9g,2018-03-01 22:03:10,Did you know? Rayquaza is said to have lived for hundreds of millions of years. The Sky High Pokémon is also the first Legendary Dragon-type Pokémon available in Pokémon GO! #TeamRayquaza,16613,149,https://scontent-sjc3-1.cdninstagram.com/vp/4d1cdf3abd3f64ad08e89419b2518c26/5B757845/t51.2885-15/e35/28153830_167052377421615_6295616646488784896_n.jpg,False
BfyovyLBoC5,2018-03-01 10:47:32,"Feeling the Earth rumble? The Continent Pokémon Groudon is said to be the personification of the land itself! Trainers, are you #TeamGroudon?",14888,186,https://scontent-sjc3-1.cdninstagram.com/vp/b4d3721d40e40eb6be1cd6ec6e346c25/5B72905B/t51.2885-15/e35/28158932_883730511799478_1073552557676167168_n.jpg,False
Bfwd--DBXTs,2018-02-28 14:35:01,"Mark your calendars, Trainers. The next #PokemonGOCommunityDay is coming your way on March 25, featuring the Grass-type Pokémon Bulbasaur! Click the link in our bio to learn more.",18200,606,https://scontent-sjc3-1.cdninstagram.com/vp/27ca19f143dc88f6d1e32b40f177e625/5B583E11/t51.2885-15/e35/28157229_163164100939468_4204289760308494336_n.jpg,False
BfuSNZ0BZJF,2018-02-27 18:13:39,"Trainers, look out for Kyogre while it swims in our planet's vast oceans. Weighing hundreds of pounds, this massive Water-type Legendary Pokémon can summon storms that cause the sea levels to rise! Tag a player who is #TeamKyogre!",12637,157,https://scontent-sjc3-1.cdninstagram.com/vp/ee6f2389b0d730afed9779dade8cb30b/5B677220/t51.2885-15/e35/28155395_983513901802909_2400500368975855616_n.jpg,False
BfrXX6ChpGR,2018-02-26 15:01:03,Time for a throwback! Trainer avatar items from Pokémon FireRed and Pokémon LeafGreen are now available!,17440,234,https://scontent-sjc3-1.cdninstagram.com/vp/fd762e7a0d3cdfffcedda87433abd607/5B75B22F/t51.2885-15/e35/28155172_749344215256306_566608492463390720_n.jpg,False
BfoTYReBmnK,2018-02-25 10:28:25,"Trainers, are you #TeamKyogre, #TeamGroudon, or #TeamRayquaza? Show us by posting an AR photo with one of these Legendary Pokémon. https://pokemongolive.com/en/post/legendaryweek022318/",17566,565,https://scontent-sjc3-1.cdninstagram.com/vp/1ec1401c32d533bf2fa9346bbbf96ef3/5B5A2FF1/t51.2885-15/e35/28430009_189851694949160_1557620918400843776_n.jpg,False
BfjQ8GWB5ZB,2018-02-23 11:30:54,#PokemonGOCommunityDay starts tomorrow! Time to meet new Pokémon GO Trainers and experience what it means to be a part of this special community.,10147,202,https://scontent-sjc3-1.cdninstagram.com/vp/e881a908d65d5e817984610125613ddb/5B59114F/t51.2885-15/e35/28150968_1984483725139624_3886856767639912448_n.jpg,False
BfirLLJBC_1,2018-02-23 06:00:54,"Attention, Trainers: Groudon and Kyogre have been awakened once again to join Rayquaza in a legendary battle all around the world in #PokemonGO!",23225,663,https://scontent-sjc3-1.cdninstagram.com/vp/f8e0e819f1c9ab2069936bd64153b0ca/5B6C9C2C/t51.2885-15/e35/27891077_155506475157201_656412586425712640_n.jpg,False
Bfe_AuNhVBj,2018-02-21 19:37:17,3 hour lures and 3x catch Stardust in 3️⃣ days. Get ready for #PokemonGOCommunityDay!,12195,207,https://scontent-sjc3-1.cdninstagram.com/vp/e340736462ba130ac7d7b62d88cffb1f/5B6DBDDB/t51.2885-15/e35/27891266_192851134651882_5346593534528978944_n.jpg,False
BfeqJG_BiQL,2018-02-21 16:34:55,"Trainers, how many Pokémon originally from the Hoenn region have you caught so far? Let us know in the comments!",14293,1310,https://scontent-sjc3-1.cdninstagram.com/vp/0105421bbed7b999ef9781b4f7aa32e0/5B5A3436/t51.2885-15/e35/28153392_1601895396595832_8236599151660367872_n.jpg,False
BfTxwOSBbSD,2018-02-17 11:09:47,"From Snubbull to Electrike, join us in celebrating the Year of the Dog by posting an AR photo of a Pokémon that resembles a real-life canine! #LunarNewYear #PokemonGO #Pokemon #Electrike",10990,107,https://scontent-sjc3-1.cdninstagram.com/vp/a95fb09a1a9a8b66e822716ac3297146/5B4EFEB3/t51.2885-15/e35/27877806_127512364645648_2128479573061402624_n.jpg,False
BfRd_rChZ83,2018-02-16 13:38:39,"Great news, Trainers! If you're lucky enough to evolve your Dragonair into Dragonite during this month's #PokemonGOCommunityDay, your Dragonite will know a special move—Draco Meteor! #Dragonite #Dratini #PokemonGO #Pokemon",15869,327,https://scontent-sjc3-1.cdninstagram.com/vp/f36c5dfe38df9c76aefd4d74872991c5/5B5AA0AD/t51.2885-15/e35/27580137_146256782711667_4416087963612479488_n.jpg,False
BfO3odwhMUN,2018-02-15 13:24:57,"Feeling lucky? Starting today until February 17, Trainers who catch a Poochyena, Growlithe, Snubbull, Eevee, or Electrike will receive bonus Stardust. Happy #LunarNewYear!",18651,242,https://scontent-sjc3-1.cdninstagram.com/vp/f538e54b193969b209086bd262cdd4b8/5B5371BE/t51.2885-15/e35/27880981_823169311188663_5638863744034406400_n.jpg,False
BfOfGCEhI7p,2018-02-15 09:50:32,Muahahaha! Get your avatar a bad new look! You can now purchase outfits honoring the original Team Rocket or the villainous Team Rainbow Rocket from the Pokémon Ultra Sun and Pokémon Ultra Moon games. #PokemonGO,14827,213,https://scontent-sjc3-1.cdninstagram.com/vp/b7cc09126b4e18164e26dd90319482a8/5B3B6BBA/t51.2885-15/e35/27879475_1193127257490353_8859900469401616384_n.jpg,False
BfL7YB-hQo9,2018-02-14 09:59:56,Celebrate #ValentinesDay with us by sharing an AR photo with Luvdisc! #PokemonGOValentines❤️,10343,83,https://scontent-sjc3-1.cdninstagram.com/vp/ddc7ae51e67b1b06aedd0fa815c56bc4/5B6E33DA/t51.2885-15/e35/27579580_1652641308162639_7811437607430127616_n.jpg,False
BfKQKzAhs1t,2018-02-13 18:23:09,Give your local Trainers some love this Valentine's Day by painting your town pink with Lure Modules that last 6 hours! Show us how you're celebrating #PokemonGOValentines❤️ by posting a photo of the PokéStops in your area! #PokemonGO #Pokemon,10377,126,https://scontent-sjc3-1.cdninstagram.com/vp/f01bf30b1d5b079625f5df65847f6f95/5B3B8467/t51.2885-15/e35/27578628_338718023293594_3566602655767724032_n.jpg,False
BfJr6QGhE1E,2018-02-13 13:06:19,"Happy Valentines, Trainers! Until February 15, schools of Luvdisc will be out swimming and awarding 3x Stardust for each one caught. #PokemonGOValentines❤️
#Luvdisc #PokemonGO",23449,351,https://scontent-sjc3-1.cdninstagram.com/vp/14ea6ad8095eb0b46f445b0f53f0e018/5B730B57/t51.2885-15/e35/27880928_175594409833904_3197586337075036160_n.jpg,False
BfHnJ0xBL-f,2018-02-12 17:46:17,"Defending your local Gym from Dragon-type Pokémon? With a strong resistance to Dragon-type attacks, Metagross is a solid choice to use as a Gym defender. #PokemonGOtip #PokemonGO #Metagross #Pokemon",14889,173,https://scontent-sjc3-1.cdninstagram.com/vp/2c8dffda291a349908c03ab649454a65/5B6101E1/t51.2885-15/e35/27574500_1879965365378396_7621968475241578496_n.jpg,False
BfCN1W2hTuP,2018-02-10 15:28:49,"Get out there and make progress on your Pokédex this weekend, Trainers! Until February 13, every Pokémon you encounter in the wild will be one originally discovered in the Hoenn region.
#PokemonGO #Pokemon #Cacnea #Numel #Aron #Baltoy",9499,117,https://scontent-sjc3-1.cdninstagram.com/vp/701102b8b5615ed4011960251de2d39b/5B5350E1/t51.2885-15/e35/27578572_629430080721308_4200669931806654464_n.jpg,False
BfAHdPzBrcA,2018-02-09 19:54:37,Plusle and Minun have been spotted playing together around the world. Go out and see if you can catch them both! #Plusle #Minun #PokemonGO #Pokemon,26771,230,https://scontent-sjc3-1.cdninstagram.com/vp/4e71ac913405fb775c1d014719be848a/5B68C570/t51.2885-15/e35/27893080_154993498492944_5826863619450601472_n.jpg,False
Be_by6vBNUB,2018-02-09 13:33:06,"Rayquaza, the Legendary Pokémon originally discovered in the Hoenn region, has descended from the ozone layer in the sky! Get ready for battle, Trainers! #PokemonGO #Rayquaza #Pokemon",28792,318,https://scontent-sjc3-1.cdninstagram.com/vp/2373826b60fe9c1ca71bf7cc2a473796/5B749AE9/t51.2885-15/e35/26870987_908520052643388_889573355764580352_n.jpg,False
Be8RVWdBYxa,2018-02-08 08:03:58,"Trainers, scan the skies and the world around you! More Pokémon originally from the Hoenn region are coming soon to Pokémon GO. Click the link in our bio to learn more.",29274,439,https://scontent-sjc3-1.cdninstagram.com/vp/ed6ab75184abccb70480d76fa6208afb/5B729F2B/t51.2885-15/e35/27580490_330772390754018_5531881412975656960_n.jpg,False
Be3h5MmhCHF,2018-02-06 11:52:28,"Trainers, don't be intimidated if you see a Slaking defending your neighborhood Gym. Although it has a high CP, Slaking is weak to Fighting-type moves from Pokémon like Hariyama. #PokemonGOtip #Slaking #Hariyama #PokemonGO",10481,143,https://scontent-sjc3-1.cdninstagram.com/vp/6be6b8be57a41affc4079c303c9b70a2/5B6BA70A/t51.2885-15/e35/26868810_158824291440113_9050652611400695808_n.jpg,False
Be1R3XbBpRq,2018-02-05 14:53:55,"From our world's green forests to its snowy mountains, Pokémon are everywhere in Pokémon GO! Snorunt live in cold regions and appear frequently during snowy weather conditions. #Snorunt #PokemonGO #Pokemon #Snow",21834,114,https://scontent-sjc3-1.cdninstagram.com/vp/28b6e9f4ed1f3e9070a02057fc4206aa/5B7245ED/t51.2885-15/e35/26866546_2004829403121456_6944495095773134848_n.jpg,False
BezWbROBcj2,2018-02-04 20:55:18,"Although you might not see a Mudkip nearby, a Mudkip might have already sensed you! The fin on Mudkip's head can sense the movements of water and air. #Mudkip #PokemonGO #Pokemon",23645,134,https://scontent-sjc3-1.cdninstagram.com/vp/de0596ed820507ba6dec12b11836f10d/5B74D948/t51.2885-15/e35/27574469_1994997794159826_3265991495219412992_n.jpg,False
BetiAU0BJI7,2018-02-02 14:41:02,"Show off how far you've walked while playing Pokémon GO with the all-new Jogger avatar items, now available to purchase after earning the Bronze, Silver, or Gold Jogger medals. #PokemonGO #Pokemon",8519,70,https://scontent-sjc3-1.cdninstagram.com/vp/1e1323fa116cd52486e1299c824e788a/5B6390E3/t51.2885-15/e35/26869867_190384964884733_3668236932204199936_n.jpg,False
BetCedmBOl0,2018-02-02 10:05:32,"Proud of your Magikarp-catching skills? With every Fisherman medal you achieve, a familiar Fisherman avatar item will be available for you to purchase in-game. Good luck—and don't get splashed!",8201,85,https://scontent-sjc3-1.cdninstagram.com/vp/87bead33c8fee2ea77efc77667c77b8c/5B5F2866/t51.2885-15/e35/27580955_154051591918550_4080603317888090112_n.jpg,False
Berk-ZKB903,2018-02-01 20:28:30,"Trainers, show off your fighting spirit! New Battle Girl avatar items are available for purchase once you achieve the Bronze, Silver, or Gold Battle Girl medals. #PokemonGO #Pokemon",12374,185,https://scontent-sjc3-1.cdninstagram.com/vp/c67b7145e0805d7652c04365b678f1f2/5B647A89/t51.2885-15/e35/27575752_1407438119366793_9194718862619181056_n.jpg,False
BerHVIhB-5g,2018-02-01 16:09:28,"Trainers, it's time to suit up! New avatar items are now available to purchase after you earn Battle Girl, Jogger, or Fisherman medals. #PokemonGO #Pokemon",14045,249,https://scontent-sjc3-1.cdninstagram.com/vp/c7b4187fd1cb063b3aae93d0394f0b42/5B64181A/t51.2885-15/e35/26871841_159605331488721_4788804147522568192_n.jpg,False
BeoYHqRhWic,2018-01-31 14:38:27,"Remember to pay attention to the weather when you're battling Kyogre, Trainers. If rain is appearing in-game, Kyogre's Water-type attacks will be even stronger! Good luck! #PokemonGOtip #PokemonGO #Pokemon 
#Kyogre",12098,166,https://scontent-sjc3-1.cdninstagram.com/vp/7c3a2d4f535e2d0ca26de79e51247a87/5B580B33/t51.2885-15/e35/26868693_513389629048424_8603879607780769792_n.jpg,False
BemATPlBc0a,2018-01-30 16:31:50,"Trainers, remember to think strategically when using your Charged TMs to teach Pokémon new Charged Attacks. Aggron can learn Charged Attacks of different types—Rock-type Stone Edge, Electric-type Thunder, or Steel-type Heavy Slam, so consider how you want to use it in battle when choosing the best TM! #PokemonGOtip #PokemonGO #Pokemon #Aggron",9959,114,https://scontent-sjc3-1.cdninstagram.com/vp/724cda9070185de886f9b2742493d03f/5B6C3C53/t51.2885-15/e35/27575828_349615212185583_3484534248877064192_n.jpg,False
BeggidIhRYI,2018-01-28 13:18:05,"As you're out exploring the real world for more Pokémon, remember to look for Whismur. Normally, Whismur's voice is very quiet—it's barely audible even if you're paying close attention. #PokemonGO #Pokemon #Whismur",9852,92,https://scontent-sjc3-1.cdninstagram.com/vp/69a865bc99fd2cb7878780724d27d5d4/5B3A2347/t51.2885-15/e35/27581325_1178632505600167_791386464893009920_n.jpg,False
BeeAkrzByzS,2018-01-27 14:00:18,"Looking to evolve Aron? With 125 Candies, Aron evolves into Aggron, a powerful Pokémon that mercilessly beats up anything that violates its environment!",11755,181,https://scontent-sjc3-1.cdninstagram.com/vp/53a706a474ccf5abeb1a9080f456c6ca/5AC600EE/t51.2885-15/e35/26869893_1153613348075109_1555677840836395008_n.jpg,False
BeWuw0uhOdA,2018-01-24 18:09:59,"New year, new loading screens! Refresh your phone's home screen by downloading the new loading screen in high resolution from the link in our bio.  #PokemonGO #Pokemon #2018",14694,135,https://scontent-sjc3-1.cdninstagram.com/vp/7536560516667ae23202ae50f282b6db/5B6D5F7B/t51.2885-15/e35/26333349_1235306209937396_1748154764392136704_n.jpg,False
BeTGBychBVP,2018-01-23 08:16:19,"Trainers, even more Pokémon originally from the Hoenn region are making their way into Pokémon GO! Click the link our bio to learn more. #Pokemon #PokemonGO",29635,460,https://scontent-sjc3-1.cdninstagram.com/vp/eb7929c5132ea3b1af2eac76208b7043/5B52E561/t51.2885-15/e35/26068699_2058898964355078_1202642219278794752_n.jpg,False
BeRHLe9BF6k,2018-01-22 13:47:54,"Mark your calendars, Trainers. The next #PokemonGOCommunityDay is coming your way on Feb 24, featuring the Dragon-type Pokémon Dratini! Learn more by clicking the link our bio. 
#Dratini",22756,628,https://scontent-sjc3-1.cdninstagram.com/vp/735921c3792f2763b48db7744ce25c31/5B5ABF9E/t51.2885-15/e35/26397083_1595369893843637_5181652088689524736_n.jpg,False
BeL7eUYBWeI,2018-01-20 13:29:24,"#PokemonGOCommunityDay challenge! Group up with your Pokémon GO team and post a photo with your #TeamInstinct, #TeamMystic, or #TeamValor teammates!",9753,128,https://scontent-sjc3-1.cdninstagram.com/vp/d4b1f6c47aa6b837b0d8e8c8ed46da64/5B703E5C/t51.2885-15/e35/26157112_409469256154021_4475755646448304128_n.jpg,False
