photo_id,date_posted,caption,comments,likes,photo_src,is_video
BeJWV6qBEOh,2018-01-19 13:26:28,"Kick off the new year, by making some new Pokémon GO friends and experiencing what it means to be part of this special community. #PokemonGOCommunityDay starts tomorrow!",9475,86,https://scontent-sjc3-1.cdninstagram.com/vp/a28720ebc3086bb3cf45f55b208d77c3/5B6C1872/t51.2885-15/e35/26186317_1448367851957146_6407595351657676800_n.jpg,False
BeDzgFBh3NC,2018-01-17 09:45:49,3-Hour Lures in 3 days. Get ready for #PokemonGOCommunityDay!,11251,119,https://scontent-sjc3-1.cdninstagram.com/vp/a1d2679477e3e87946ee0d54c593c459/5B5D6D94/t51.2885-15/e35/26073749_972857029545761_2063324111727230976_n.jpg,False
BeBx-68BCwB,2018-01-16 14:54:04,"4 days left until #PokemonGOCommunityDay! Who's excited to catch Pikachu with the exclusive event move, Surf?
#Pikachu #PokemonGO #Pokemon #SurfingPikachu",14971,290,https://scontent-sjc3-1.cdninstagram.com/vp/cc37cb63344413c2c70685f348207960/5B4FD53A/t51.2885-15/e35/26073115_159460841368198_5486441213034758144_n.jpg,False
BeBOzfMBzGx,2018-01-16 09:46:40,"Trainer Level Badges are back in stock! Head over to your nearest @sprint Gym to get yours, and be sure to ask about $100 in free PokéCoins when you switch to Sprint or add a line.",14612,277,https://scontent-sjc3-1.cdninstagram.com/vp/e3b363dce8c473acfc8b36ef5c833432/5B39AA96/t51.2885-15/e35/26276795_403376780083258_2881145499031699456_n.jpg,False
Bd_urWRBFbI,2018-01-15 19:46:42,"Recently, a group of Trainers from a small town in Indonesia spent a weekend together playing Pokémon GO and battling over 40 Raid Bosses! This group of Trainers went from not knowing one another to being so close that they now call their group, “the family.” Trainers, as you prepare for #PokemonGOCommunityDay, have you made new friends through Pokémon GO? #PokemonGO #Pokemon",12590,241,https://scontent-sjc3-1.cdninstagram.com/vp/fc744f190f69b3c6c2e2a393648e3fc1/5B5547DD/t51.2885-15/e35/26156400_1813614478941194_4061106824949006336_n.jpg,False
Bd8bXTABboV,2018-01-14 13:00:13,Caught a Kyogre or Groudon lately? Share a photo of either Pokémon with the hashtag #TeamKyogre or #TeamGroudon.  #Pokemon #PokemonGO,11818,225,https://scontent-sjc3-1.cdninstagram.com/vp/bdc027369db7751d7e80bafbfaba6a3f/5B6E213A/t51.2885-15/e35/26151810_802067213310186_3732086122184966144_n.jpg,False
Bd3S8_QhQx2,2018-01-12 13:10:31,"Get ready, Trainers! Kyogre, the Water-type Legendary Pokémon originally discovered in the Hoenn region, has arrived with a splash in Raid Battles around the world. #PokemonGO #Kyogre #Pokemon",28761,479,https://scontent-sjc3-1.cdninstagram.com/vp/c33ba1fca5e7cd9d2ef74eae24146831/5B525CA1/t51.2885-15/e35/26065234_1931353520464007_4531445163070849024_n.jpg,False
Bd2wM9UhJvG,2018-01-12 08:06:52,Celebrate the first Pokémon GO Community Day with us on January 20! Bring a friend and learn more by clicking the link our bio. #PokemonGOCommunityDay,14265,173,https://scontent-sjc3-1.cdninstagram.com/vp/ff30af6731ee270c493be205f2592c92/5B6DEF1F/t51.2885-15/e35/26070145_117206175693775_78753679980625920_n.jpg,False
Bdf7kRfhGNb,2018-01-03 11:23:38,"Trainers, which six Pokémon are in your favorite Raid Battle party? Tell us in the comments! #PokemonGO #Pokemon",12739,594,https://scontent-sjc3-1.cdninstagram.com/vp/ba5b3ec007b69893c1ad271ded4b7fc1/5B610C76/t51.2885-15/e35/26187483_1434598246662752_6731849456766943232_n.jpg,False
BdWtgkQBe8M,2017-12-30 21:27:38,"Trainers, what's the weather like for you today? Share a photo of the Pokémon appearing near you with the hashtag #PokemonGO. We'd love to see all of your different adventures!",8923,169,https://scontent-sjc3-1.cdninstagram.com/vp/1a19e08d87d011fce78298971f6ed2d3/5B52922D/t51.2885-15/e35/25015813_736824146503402_8318010093547290624_n.jpg,False
BdVy_veBZ_U,2017-12-30 12:56:20,"Did you know? With enough Candies, Ralts can evolve into Gardevoir—a Pokémon that has the ability to read the future. #Pokemon #PokemonGO #Ralts #Gardevoir #Kirlia",10751,185,https://scontent-sjc3-1.cdninstagram.com/vp/edb819018bbf3e4d33ae47f2b408803d/5B6979CB/t51.2885-15/e35/26298830_158255421562728_1691950023492763648_n.jpg,False
BdQjr6MhElO,2017-12-28 12:06:21,"As you embark on more holiday adventures, be on the lookout for Pikachu wearing a familiar festive hat! If you spot one, spread the holiday cheer by sharing an AR photo of it on social channels with #HolidayPikachu before they leave in a few days! #Pokemon #PokemonGO #Pikachu",14213,120,https://scontent-sjc3-1.cdninstagram.com/vp/5f90369781bb56e59c8bfb26024ee3b6/5B51BA98/t51.2885-15/e35/26182870_788039084717064_6329372860347318272_n.jpg,False
BdLkr0jBD2O,2017-12-26 13:38:53,Slaking spends all day lying down and lolling about. Let us know in the comments below if this sounds like something you would do on a sleepy Sunday. #PokemonGO #Pokemon #Slaking,13217,221,https://scontent-sjc3-1.cdninstagram.com/vp/86437ca57f14225741ba552561c47e5d/5B573328/t51.2885-15/e35/26068515_2004880169790009_8664384212238860288_n.jpg,False
BdJVY6Ph_5l,2017-12-25 16:46:44,Celebrate the arrival of more Pokémon originally from the Hoenn region by downloading the new loading screen! Now available for free in high resolution. Click the link in our bio to learn more. #Pokemon #PokemonGO #Minun #Plusle,10675,66,https://scontent-sjc3-1.cdninstagram.com/vp/99d935688d0c807029c2f772fd7fd29b/5B71FC1D/t51.2885-15/e35/25023285_322119628290574_2163549471386894336_n.jpg,False
BdBTH9YB0YX,2017-12-22 13:53:02,"Trainers, as you embark on new adventures to look for Pokémon originally from the Hoenn region, which Pokémon will you choose to be your Buddy Pokémon? Tell us in the comments! 
#PokemonGO #Pokemon #Feebas",16295,837,https://scontent-sjc3-1.cdninstagram.com/vp/3a36bd3c6c37f30a8cd47b493e4421f8/5B4F65C6/t51.2885-15/e35/25015969_1461677553945679_3498539235286188032_n.jpg,False
Bc-fVqbh2BN,2017-12-21 11:42:02,"Trainers, AR+ is now live for iPhone 6s users with iOS 11 or above. As you start to use this feature to interact with Pokémon in new and exciting ways, remember to share some of your favorite AR+ moments on social media with #PokemonGOarplus!",11848,218,https://scontent-sjc3-1.cdninstagram.com/vp/b473675db075d84d1cd47cd5f1867f1a/5B545C53/t51.2885-15/e35/25012311_831817933687999_2395114488576606208_n.jpg,False
Bc94L3pB592,2017-12-21 05:59:55,"This holiday season, celebrate with us—and a few new Pokémon friends. Click the link in our bio to learn more. #PokemonGO #Pokemon",26940,309,https://scontent-sjc3-1.cdninstagram.com/vp/f67ce0abca4738dc1e624174d39664cc/5B4ECB2A/t51.2885-15/e35/25037682_193144474596389_7715317373217013760_n.jpg,False
Bc7Upu6B89E,2017-12-20 06:10:56,Get ready for even more realistic Pokémon encounters: AR+ is coming to Pokémon GO! Click the link in our bio to learn more. #PokemonGOarplus #PokemonGO #Pokemon,15246,334,https://scontent-sjc3-1.cdninstagram.com/vp/4a4f53535b47c748b30f101119088b8c/5B6BD6EC/t51.2885-15/e35/25008852_127740058016281_234865141210939392_n.jpg,False
BcvKByHBf_x,2017-12-15 12:47:13,"Watch out, Trainers! Groudon, the Ground-type Legendary Pokémon originally discovered in the Hoenn region, is now appearing in Raid Battles around the world. Click the link in our bio to learn more. #PokemonGO #Pokemon #Groudon",20190,369,https://scontent-sjc3-1.cdninstagram.com/vp/1dbdaae02e44d200a13a797e103187b2/5B3A9382/t51.2885-15/e35/25006538_1213930105417579_2638508537189236736_n.jpg,False
BciRlH2hesc,2017-12-10 12:43:05,"Check the weather report, Trainers. Tap the in-game weather icon to see how your local weather impacts Pokémon around you! #PokemonGO #Pokemon",12015,195,https://scontent-sjc3-1.cdninstagram.com/vp/7a5a86bffa465652f95a60350476747c/5AC569B9/t51.2885-15/e15/25012284_172078346870794_1367630875398766592_n.jpg,False
BcdD-I7hpo5,2017-12-08 12:07:57,"Trainers, dozens of Pokémon originally from the Hoenn region have been spotted all over the world! #Pokemon #PokemonGO #Mudkip #Torchic #Treecko",27411,357,https://scontent-sjc3-1.cdninstagram.com/vp/e1c873455e359eefea1d1385f70b62d3/5B578088/t51.2885-15/e35/24328008_1923812907935395_6531967773369696256_n.jpg,False
BcaOtW7BFfF,2017-12-07 09:44:04,"You’ll want to start paying even closer attention to your local weather patterns, Trainers. Dynamic weather gameplay is coming to Pokémon GO! Click the link in our bio to learn more. #PokemonGO #Pokemon",18115,433,https://scontent-sjc3-1.cdninstagram.com/vp/d875ec908561e63a93eab2433e5b0463/5B7180B8/t51.2885-15/e35/25017700_1182245848576568_1272690266838401024_n.jpg,False
BcXRgZvBpRn,2017-12-06 06:11:20,Dozens of Pokémon originally discovered in the Hoenn region will soon arrive in the real world! Click the link in our bio to learn more. #PokemonGO,19611,831,https://scontent-sjc3-1.cdninstagram.com/vp/7ae80e6bb3bef243e1c97e13c852518a/5AC51A6C/t51.2885-15/s1080x1080/e15/fr/25006964_213805509163864_5611790808526094336_n.jpg,True
BcH3mKoh5YG,2017-11-30 06:37:00,"7 days, 3.36 billion Pokémon caught by millions of Trainers worldwide. We followed 6 of them. See the link in our bio learn more. #PokemonGOtravel #PokemonGO #Pokemon",7027,78,https://scontent-sjc3-1.cdninstagram.com/vp/8396fea69702ee6a1346c15c593526dd/5AC52B75/t51.2885-15/e15/24274697_159365434812369_2107922137300860928_n.jpg,True
BcBSRUgBVqu,2017-11-27 17:15:18,"Thanks to all your hard work last week, Ho-Oh will appear in Raid Battles until 12/12! Check out the link in our bio for more info. #PokemonGOtravel 
#GlobalCatchChallenge #PokemonGO #Pokemon",11586,299,https://scontent-sjc3-1.cdninstagram.com/vp/4f8121dcc543cceff145986c80e51c69/5AC58373/t51.2885-15/e15/24174864_731833797021634_8554932025876807680_n.jpg,True
Bb-2qTkhZmO,2017-11-26 18:34:26,"It’s been a busy week of catching Pokémon around the world! Thanks to all the Trainers who took part in the Global Catch Challenge. #PokemonGOtravel #GlobalCatchChallenge #PokemonGO #Pokemon #Japan 
@tiffyquake @CdNLeon @jeffyfeng @redb15 @nilmoretto @SeltzerPlease",7118,57,https://scontent-sjc3-1.cdninstagram.com/vp/c763df861bff287c47317a732724df15/5B5D94AC/t51.2885-15/e35/24175329_561222160896020_5762304333936852992_n.jpg,False
Bb-Z02phtMZ,2017-11-26 14:22:28,"Pokémon GO Travel ends the Global Catch Challenge in the magnificent dunes of Tottori, Japan. PokemonGOtravel #PokemonGO  #GlobalCatchChallenge #Tottori #Japan #Pokemon",5777,30,https://scontent-sjc3-1.cdninstagram.com/vp/62bb6c5dc3bd2eb35414046668c68341/5B6D9602/t51.2885-15/e35/23969720_335935826880606_8823198144201228288_n.jpg,False
Bb-CktSBCpt,2017-11-26 10:59:59,We had an amazing time catching Pokémon alongside thousands of Trainers at the Pokémon GO Safari Zone event in Tottori. #PokemonGOtravel #PokemonGO #Tottori @tiffyquake @CdNLeon @jeffyfeng @redb15 @nilmoretto @SeltzerPlease,4362,33,https://scontent-sjc3-1.cdninstagram.com/vp/1513a11ffbdad733f0e9497b9d554d22/5AC5F0FD/t51.2885-15/e15/23967428_130797867603376_7702004267384569856_n.jpg,True
Bb8G7XYBJfY,2017-11-25 17:01:10,"Congratulations, Trainers! You did it! You’ve caught over 3 billion Pokémon and unlocked a new reward during the Global Catch Challenge. #PokemonGO #Pokemon #PokemonGOtravel #GlobalCatchChallenge",11762,456,https://scontent-sjc3-1.cdninstagram.com/vp/66a5e157b319cae4d20359e596c59042/5AC5E9A4/t51.2885-15/e15/23967138_162473964353402_7899649737404448768_n.jpg,True
Bb7ynS3heAE,2017-11-25 14:02:12,Pokémon GO Travel takes the Global Catch Challenge to Kyoto #PokemonGOtravel #GlobalCatchChallenge #PokemonGO #Pokemon #Kyoto #Japan,4871,68,https://scontent-sjc3-1.cdninstagram.com/vp/db785ce1bea7aa80efd3f2953ac23b4f/5AC58AEC/t51.2885-15/e15/24126434_2032786180333214_8489783333411094528_n.jpg,True
Bb50we1h8Ef,2017-11-24 19:41:36,"Sometimes you have to go the extra mile to catch Pokémon, and sometimes that extra mile is down the beautiful Hozu River. #PokemonGOtravel #Pokemon #PokemonGO #HozuRiver",5724,39,https://scontent-sjc3-1.cdninstagram.com/vp/90b4bb9fa70b826af675d07974b9cf7a/5B519A42/t51.2885-15/e35/23824825_234656553737892_761915438689943552_n.jpg,False
Bb5WDiShqro,2017-11-24 15:14:10,"We've been busy taking AR photos with the friendly deer in Nara Park, Japan. Show us your favorite Pokémon GO AR photos. #PokemonGOtravel #GlobalCatchChallenge",4301,40,https://scontent-sjc3-1.cdninstagram.com/vp/da93b55143e22a4952ce08b6257cf48d/5AC592F3/t51.2885-15/e15/23823992_172955733291187_5594114161949802496_n.jpg,True
Bb3O_V6BsuI,2017-11-23 19:33:06,Check out some of our favorite photos from an afternoon catching Stantler and other Pokémon alongside the friendly deer in Nara Park. #PokemonGOtravel #Pokemon #Japan #Travel #PokemonGO #NaraPark,7634,57,https://scontent-sjc3-1.cdninstagram.com/vp/9eb36b5b63bd259461a0848b37435806/5B73E00B/t51.2885-15/e35/23966812_1991674441115762_1448051788669255680_n.jpg,False
Bb2v--ZBo_v,2017-11-23 15:04:07,Our hosts have taken the Global Catch Challenge to the majestic Lake Yamanaka at the foot of Mount Fuji. #PokemonGOtravel #PokemonGO #Pokemon #MtFuji,4024,47,https://scontent-sjc3-1.cdninstagram.com/vp/0aed8414fd1149b52fd1c4cfc4c57de1/5AC5DE9B/t51.2885-15/e15/23823527_1750553368582873_1685944456622112768_n.jpg,True
Bb1DTFmhwM7,2017-11-22 23:12:43,"Great work, Trainers! You’ve collectively caught over 1.5 billion Pokémon and unlocked even more rewards during the #PokemonGOtravel Global Catch Challenge.",7166,138,https://scontent-sjc3-1.cdninstagram.com/vp/49fb1d33054f0502fc212c17a3bee4d5/5AC584E6/t51.2885-15/e15/23734626_540464866308048_8362107046761332736_n.jpg,True
Bb0l2mOBcBk,2017-11-22 18:55:10,Our hosts have taken the Global Catch Challenge to the majestic Lake Yamanaka at the foot of Mount Fuji. #PokemonGOtravel #Pokemon #PokemonGO #MtFuji #Travel #Japan,8026,43,https://scontent-sjc3-1.cdninstagram.com/vp/d7ca81b9b19c618cc68a77cfd327526a/5B675231/t51.2885-15/e35/23734481_904206516409194_5933347326281121792_n.jpg,False
Bb0Nw-jh7yX,2017-11-22 15:26:33,Pokémon GO Travel takes the Global Catch Challenge to Tokyo Tower to battle a powerful Raid Boss. #PokemonGOtravel #PokemonGO #Pokemon #Japan  #Tokyo #MtFuji,4462,51,https://scontent-sjc3-1.cdninstagram.com/vp/5d74813ca672346f9e913a8e5c4bcd78/5AC5DF3D/t51.2885-15/e15/23825063_156205125111508_3033364590315438080_n.jpg,True
BbyBxlGher9,2017-11-21 19:01:25,"Pokémon GO Travel has taken the Global Catch Challenge to Japan, the place where Pokémon began. #PokemonGOtravel #Japan #Travel #Akihabara #Pokemon #PokemonGO",7229,55,https://scontent-sjc3-1.cdninstagram.com/vp/4083f67c237b0265e640a67b0b49971b/5B564E0F/t51.2885-15/e35/23733933_1488807867893681_2508134452731838464_n.jpg,False
BbxkqHIBAvO,2017-11-21 14:47:54,"On the first day of the Pokémon GO Travel Global Catch Challenge, we explore Akihabara in Tokyo to catch some Pokémon at the many lured PokéStops in the area. #PokemonGOtravel #Pokemon #PokemonGO #Japan #Travel",5251,76,https://scontent-sjc3-1.cdninstagram.com/vp/c4782c00721e67d1dc48b71ad40dab48/5AC52FA1/t51.2885-15/e15/23734967_1520079664751978_759362531604037632_n.jpg,True
BbwOe0DhDfd,2017-11-21 02:13:58,"Team photo! Pokémon GO Travel has brought these Trainers from around the world to Japan to host the first-ever Global Catch Challenge. Follow @tiffyquake, @CdNLeon, @jeffyfeng, @redb15, @nilmoretto, and @SeltzerPlease to watch their adventure unfold. #PokemonGOtravel #PokemonGO #Pokemon #Travel #Japan",12250,169,https://scontent-sjc3-1.cdninstagram.com/vp/8e8b1cbbe7db195e269e2ce963f4c893/5B7453B1/t51.2885-15/e35/23668359_1920152368001492_3678525650915819520_n.jpg,False
BbulYnihldb,2017-11-20 10:55:52,"Awesome work, Trainers! You’ve made amazing progress after just one day of the Global Catch Challenge! #PokemonGOtravel #PokemonGO #Pokemon",8041,311,https://scontent-sjc3-1.cdninstagram.com/vp/53cc15b52bc3351ca72b27e785002b52/5AC51500/t51.2885-15/e15/23734783_146145459362177_8001857207291346944_n.jpg,True
BbsCe2dhoA5,2017-11-19 11:13:10,"Introducing #PokemonGOtravel. Follow along as we explore Japan, catch Pokémon, and make new friends. Participate in the Global Catch Challenge to unlock amazing in-game rewards! Click the link in our bio to learn more. #Pokemon #PokemonGO",11010,429,https://scontent-sjc3-1.cdninstagram.com/vp/e263b1f9801e9b202037d520172c622a/5AC591E0/t51.2885-15/e15/23823643_1816529168419460_319101200916021248_n.jpg,True
Bbp4saoBiUg,2017-11-18 15:08:09,"After reviewing over 50,000 amazing submissions, we’re excited to showcase the winners of our first #PokemonGOcontest! 🏆 Thank you to all those who participated, and congratulations to all the winning Trainers who truly impressed us with their photos! #PokemonGO #Pokemon",18323,343,https://scontent-sjc3-1.cdninstagram.com/vp/c15464d8bb91c7f7e3b923c079d5e033/5B73EB5A/t51.2885-15/e35/23733710_710421592488181_6886960890696957952_n.jpg,False
Bbh1d1-hFbb,2017-11-15 12:06:01,We had an incredible time meeting all the Trainers who attended the Pokémon GO Week festivities in Korea this past weekend! #Pokemon #PokemonGO #Korea,16889,212,https://scontent-sjc3-1.cdninstagram.com/vp/8b79aaecf522f40fe3ee4c7874a5e181/5B4FD756/t51.2885-15/e35/23595973_1974574102767393_8919626671166849024_n.jpg,False
Bbc28HQnAiT,2017-11-13 13:42:41,"Trainers, it’s time for a style change! To celebrate the upcoming launch of the Pokémon Ultra Sun and Pokémon Ultra Moon games on November 17, new avatar items from the Alola region are now available for free in Pokémon GO. #Pokemon #PokemonGO #PokemonUltraSunMoon",16037,303,https://scontent-sjc3-1.cdninstagram.com/vp/85b007f967518c69980ad5ec7f20d719/5B7167A2/t51.2885-15/e35/23498625_153559851924399_3785611306002808832_n.jpg,False
BbU2bhxHr3Y,2017-11-10 11:04:19,"Do you have any memorable moments playing Pokémon GO with your family? Submit your story, Trainer name, avatar screenshot, and any photos related to your story to trainerspotlight@nianticlabs.com. Our favorite story will be featured in our November newsletter! #PokemonGO #Pokemon",9016,131,https://scontent-sjc3-1.cdninstagram.com/vp/e3799a2da9eca4aa94437f095d0a4847/5B702EC8/t51.2885-15/e35/23347657_149470579021553_6505689995221663744_n.jpg,False
BbNbQcbBlIp,2017-11-07 13:52:11,"Thank you to everyone who participated in the #PokemonGOcontest! We've completed our review of the submissions and will be reaching out to all the winners. Participants, please check your Instagram inbox in the next few days to see if your submission has won. #Pokemon #PokemonGO",6479,118,https://scontent-sjc3-1.cdninstagram.com/vp/882654a9d3ec781f68b5b3de981d4fcd/5B4F84D4/t51.2885-15/e35/23348182_153446038600267_5049373409574649856_n.jpg,False
BbCokMHhN_h,2017-11-03 10:16:50,"Over the past few months, we've hosted seven different Pokémon GO Safari Zone events at Unibail-Rodamco shopping centres located throughout Europe. In total, over 20 thousand Trainers from all around the world came together at these locations to celebrate their love for Pokémon GO and develop new friendships. It was incredible to witness so many Trainers work together to catch over 6 million Pokémon at these events! #PokemonGO #Pokemon",11612,303,https://scontent-sjc3-1.cdninstagram.com/vp/1c2923fa171ce2e4adaf10e3dae245ac/5B6CF5CD/t51.2885-15/e35/23164070_149058759068221_5329489870949711872_n.jpg,False
Ba-AUmehoEM,2017-11-01 15:08:13,"Don't be spooked, Trainers, but you only have one more day to catch the limited-time #PokemonGOHalloween Pikachu. #Pokemon #PokemonGO",7461,101,https://scontent-sjc3-1.cdninstagram.com/vp/4dd00e20b97e120f3a89f6e962616785/5B5774DA/t51.2885-15/e35/23101185_340186126392195_3839782710600007680_n.jpg,False
Ba6tvLPBzEx,2017-10-31 08:28:06,It's Halloween! Put on your Mimikyu Disguise Hat and show us your avatar's best #PokemonGOHalloween costume.,6945,51,https://scontent-sjc3-1.cdninstagram.com/vp/33fcc6673416a27c517885891349ee3f/5B6B7D93/t51.2885-15/e35/23101199_259738631216481_5653377958946013184_n.jpg,False
Ba4xVofBei7,2017-10-30 14:21:05,"Remember to stock up on Candy while you're out trick-or-treating, Trainers! Until November 2nd, you'll earn double Candy for catching, hatching, and transferring Pokémon. #PokemonGOHalloween",7102,50,https://scontent-sjc3-1.cdninstagram.com/vp/b27aebc926c286bf2fcc017ece6c5a9e/5B52D55D/t51.2885-15/e35/22857640_1978326682407646_4265734309769379840_n.jpg,False
Baz3wd1B2cL,2017-10-28 16:40:58,"You can run, but you can’t hide. Once Duskull chooses a target, it will doggedly pursue the intended victim until the break of dawn. Learn more about spooky Pokémon by checking out our Instagram Stories. #PokemomGOHalloween #PokemonGO #Pokemon",7018,60,https://scontent-sjc3-1.cdninstagram.com/vp/f2a229c4fe4045c278cd52d0dde88249/5B606BD5/t51.2885-15/e35/22858116_351058882025928_213955638391209984_n.jpg,False
BaxOk7MByHc,2017-10-27 16:02:39,"Trainers, take advantage of the scary good #PokemonGOHalloween deals before the discounted boxes disappear on November 2. These boxes include Super Incubators, Raid Passes, and more! #PokemonGO #Pokemon",6429,81,https://scontent-sjc3-1.cdninstagram.com/vp/7d832bd45ac1730dcee4223018550e0f/5B64D2D6/t51.2885-15/e35/22711015_917852691702393_1317992731473084416_n.jpg,False
BapgT5Ch7xP,2017-10-24 16:03:41,"Trainers, you only have until October 25, 11:59 p.m. PST, before we close AR photo submissions for the #PokemonGOcontest. Good luck! Click the link in our bio to see contest info. #PokemonGO #Pokemon",5822,70,https://scontent-sjc3-1.cdninstagram.com/vp/438aa6b99761bf151fc99cb970afae32/5B5C693F/t51.2885-15/e35/22709350_1871539863175176_7899721128350842880_n.jpg,False
Bam_t1lhqJo,2017-10-23 16:40:24,Snap an AR photo of a spooky-looking Pokémon during your Halloween adventures? Post it on Instagram with the hashtag #PokemonGOcontest to enter our AR Photo Contest. We'd love to see it! Click the link in our bio to see contest info. #PokemonGO #Pokemon,8809,82,https://scontent-sjc3-1.cdninstagram.com/vp/6f08de916f472773fe17292a7cb5dfd2/5B6CE269/t51.2885-15/e35/22793740_126112984761843_6159957424385032192_n.jpg,False
BakWOmVBike,2017-10-22 15:59:23,Get into the Halloween spirit by downloading this year's spooky #PokemonGOHalloween loading screen here: http://bit.ly/2yZY98f #PokemonGO #Pokemon,10116,61,https://scontent-sjc3-1.cdninstagram.com/vp/ca8e8c01e26e9a05bc994a071843ea17/5B6D9F46/t51.2885-15/e35/22637606_180423932519220_3075996027673640960_n.jpg,False
Bah9izhBN6g,2017-10-21 17:45:12,"Trainers, your #PokemonGOcontest photos have been awesome! Here are a few of our favorites so far. Keep them coming! Check out our stories to see even more AR photo highlights per day. Click the link in our bio to see contest info. #PokemonGO #Pokemon",13161,203,https://scontent-sjc3-1.cdninstagram.com/vp/c6583176cadd6271cbd5a13fc8def17a/5B6C0951/t51.2885-15/e35/22637702_522358828113801_4595402702191591424_n.jpg,False
BaezyHMBtLw,2017-10-20 12:22:12,"The #PokemonGOHalloween celebration starts now! Get outside, catch spooky Pokémon, and earn double Candy! #PokemonGO #Pokemon",18748,259,https://scontent-sjc3-1.cdninstagram.com/vp/5f8de14f03a59442a0a1a398bff502b7/5B502A52/t51.2885-15/e35/22582367_178569569385272_541641001463185408_n.jpg,False
BablZdzBsDQ,2017-10-19 06:19:17,"Trainers, #PokemonGOHalloween is just around the corner! Trick-or-treat with us for double Candy rewards, catch scary Pokémon—including Sableye and Banette, originally discovered in the Hoenn region—and dress up your avatar for the occasion! Visit the link in our bio for more info. #Pokemon #PokemonGO",15059,489,https://scontent-sjc3-1.cdninstagram.com/vp/8f09e079a4a11aa7617d6aa3c7166ae4/5AC56B5B/t51.2885-15/s1080x1080/e15/fr/22582442_139696486662254_5022205761447526400_n.jpg,True
BaUkRrghnc6,2017-10-16 12:54:17,"Trainers, can you top this photo? Post your own on Instagram with the hashtag #PokemonGOcontest! Click the link in our bio to see contest info. #Pokemon",9131,110,https://scontent-sjc3-1.cdninstagram.com/vp/e8cf307611a865a4e66cf1062b9a1695/5B5487E8/t51.2885-15/e35/22500184_524843931184716_9218581043785760768_n.jpg,False
BaKKom8B_Qm,2017-10-12 11:57:49,"Go on an adventure, be creative, and have fun! We’re excited to see what you come up with for the #PokemonGOcontest. Click the link in our bio to see contest info. #Pokemon",8020,101,https://scontent-sjc3-1.cdninstagram.com/vp/97574bc48fc91ae75825b258b384cc98/5B68B278/t51.2885-15/e35/22352077_155805455019031_5370949602574860288_n.jpg,False
BaH2KAkBjU_,2017-10-11 14:20:24,"Calling all Trainers! Starting today, we’re challenging you to snap epic Pokémon GO AR photos and post them on Instagram using the hashtag #PokemonGOcontest. Do you have what it takes to be the best? If so, you could win one of 10 Pokémon GO Prize Packs. Click the link in our bio to see contest info. #Pokemon",8942,223,https://scontent-sjc3-1.cdninstagram.com/vp/3c834a6688e44b19c8ee0fac0fed160c/5B74B22F/t51.2885-15/e35/22352517_1961706067436677_7852321199257288704_n.jpg,False
BZpJZPBBfTx,2017-09-29 16:12:03,Which of these Legendary Johto #Pokemon are you hoping will come to your region next? #PokemonGO,7982,719,https://scontent-sjc3-1.cdninstagram.com/vp/fe3c77859f90d00d4912066f911ee03b/5B5A26AE/t51.2885-15/e35/22069356_177338459480622_2963097147236417536_n.jpg,False
BZmTyVahyVm,2017-09-28 13:45:08,"For a limited time: Chansey, Mareep, Larvitar, and others are hatching from special 2 km Eggs. Get to walking, Trainers! #PokemonGO #Pokemon",6322,151,https://scontent-sjc3-1.cdninstagram.com/vp/930234932e622ff0a86c89932ae55593/5AC57E4A/t51.2885-15/e15/22071097_119364958736793_2850409132513558528_n.jpg,True
BZjx3A4Bd2D,2017-09-27 14:10:12,"Millions of Trainers have walked over 1,000 km while exploring the world with Pokémon GO. Trainers, tell us how far you've walked in the comments below. #PokemonGO #Pokemon",8798,800,https://scontent-sjc3-1.cdninstagram.com/vp/e9f78f66288d1c40b26642f1624abb8d/5B68CD56/t51.2885-15/e35/22069341_1441601715895712_4373220887168548864_n.jpg,False
